{
  "$schema": "https://json-schema.org/draft/2020-12/schema",
  "$id": "cn-patent-drawing-brief/v3",
  "title": "中国专利附图绘制交接合同 v3",
  "description": "在 v2 来源绑定和官方导出基础上，冻结单图唯一问题、阅读层级、复杂度预算、独立线路通道、正常/异常出口和正文图示声明。",
  "type": "object",
  "required": [
    "schema_id",
    "case_id",
    "production_skill",
    "source_artifacts",
    "output_root",
    "global_constraints",
    "visual_review_path",
    "figures"
  ],
  "properties": {
    "schema_id": {
      "const": "cn-patent-drawing-brief/v3"
    },
    "case_id": {
      "type": "string",
      "minLength": 1
    },
    "generated_at": {
      "type": "string",
      "minLength": 1
    },
    "source_artifacts": {
      "type": "array",
      "minItems": 3,
      "items": {
        "type": "object",
        "required": [
          "artifact_id",
          "path",
          "sha256"
        ],
        "properties": {
          "artifact_id": {
            "enum": [
              "claims",
              "specification",
              "feature_ledger",
              "figure_index",
              "other"
            ]
          },
          "path": {
            "type": "string",
            "minLength": 1
          },
          "sha256": {
            "type": "string",
            "pattern": "^[0-9a-f]{64}$"
          }
        },
        "additionalProperties": false
      }
    },
    "output_root": {
      "type": "string",
      "minLength": 1
    },
    "global_constraints": {
      "type": "object",
      "required": [
        "color_policy",
        "figure_number_on_canvas",
        "edge_labels_allowed",
        "annotation_nodes_may_be_edge_endpoints",
        "official_drawio_export_required",
        "visual_review_required",
        "single_primary_question_required",
        "independent_route_channels_required",
        "final_png_visual_review_required"
      ],
      "properties": {
        "figure_number_on_canvas": {
          "const": false
        },
        "edge_labels_allowed": {
          "const": false
        },
        "annotation_nodes_may_be_edge_endpoints": {
          "const": false
        },
        "official_drawio_export_required": {
          "const": true
        },
        "visual_review_required": {
          "const": true
        },
        "minimum_png_dpi": {
          "type": "number",
          "minimum": 150,
          "default": 300
        },
        "component_mark_pattern": {
          "type": "string",
          "default": "^[0-9]+$"
        },
        "step_mark_pattern": {
          "type": "string",
          "default": "^S[0-9]+$"
        },
        "color_policy": {
          "type": "object",
          "required": [
            "mode",
            "grayscale_safe",
            "color_semantics_redundant",
            "max_nonwhite_fills",
            "allowed_fill_colors",
            "allowed_stroke_colors"
          ],
          "properties": {
            "mode": {
              "enum": [
                "monochrome",
                "restrained_color"
              ]
            },
            "grayscale_safe": {
              "const": true
            },
            "color_semantics_redundant": {
              "const": true
            },
            "max_nonwhite_fills": {
              "type": "integer",
              "minimum": 0,
              "maximum": 3
            },
            "allowed_fill_colors": {
              "type": "array",
              "minItems": 1,
              "items": {
                "type": "string",
                "pattern": "^#[0-9A-Fa-f]{6}$"
              }
            },
            "allowed_stroke_colors": {
              "type": "array",
              "minItems": 1,
              "items": {
                "type": "string",
                "pattern": "^#[0-9A-Fa-f]{6}$"
              }
            },
            "palette_asset": {
              "type": "string"
            }
          },
          "additionalProperties": false
        },
        "single_primary_question_required": {
          "const": true
        },
        "independent_route_channels_required": {
          "const": true
        },
        "final_png_visual_review_required": {
          "const": true
        }
      },
      "additionalProperties": true
    },
    "visual_review_path": {
      "type": "string",
      "minLength": 1
    },
    "figures": {
      "type": "array",
      "minItems": 1,
      "items": {
        "type": "object",
        "required": [
          "figure_number",
          "title",
          "file_stem",
          "diagram_type",
          "orientation",
          "style_profile",
          "purpose",
          "claim_numbers",
          "spec_anchors",
          "elements",
          "relations",
          "outputs",
          "primary_question",
          "reading_direction",
          "layers",
          "complexity_budget",
          "normal_exit_ids",
          "exception_exit_ids",
          "spec_assertions"
        ],
        "properties": {
          "figure_number": {
            "type": "integer",
            "minimum": 1
          },
          "title": {
            "type": "string",
            "minLength": 1
          },
          "file_stem": {
            "type": "string",
            "minLength": 1
          },
          "diagram_type": {
            "enum": [
              "system_block",
              "method_flowchart",
              "interaction_sequence",
              "state_machine",
              "data_flow",
              "internal_structure",
              "cross_functional_flow",
              "network_topology",
              "data_structure"
            ]
          },
          "orientation": {
            "enum": [
              "portrait",
              "landscape"
            ]
          },
          "purpose": {
            "type": "string",
            "minLength": 1
          },
          "claim_numbers": {
            "type": "array",
            "items": {
              "type": "integer",
              "minimum": 1
            }
          },
          "spec_anchors": {
            "type": "array",
            "minItems": 1,
            "items": {
              "type": "string",
              "minLength": 1
            }
          },
          "elements": {
            "type": "array",
            "minItems": 1,
            "items": {
              "type": "object",
              "required": [
                "id",
                "label",
                "kind",
                "source_anchor",
                "layer_id"
              ],
              "properties": {
                "id": {
                  "type": "string",
                  "pattern": "^[A-Za-z0-9_.:-]+$"
                },
                "label": {
                  "type": "string",
                  "minLength": 1
                },
                "kind": {
                  "enum": [
                    "component",
                    "step",
                    "actor",
                    "data_store",
                    "annotation",
                    "start_end",
                    "decision"
                  ]
                },
                "reference_sign": {
                  "type": "string"
                },
                "source_feature_ids": {
                  "type": "array",
                  "items": {
                    "type": "string"
                  }
                },
                "source_anchor": {
                  "type": "string",
                  "minLength": 1
                },
                "preferred_shape": {
                  "type": "string"
                },
                "layer_id": {
                  "type": "string",
                  "pattern": "^[A-Za-z0-9_.:-]+$"
                }
              },
              "additionalProperties": true
            }
          },
          "relations": {
            "type": "array",
            "items": {
              "type": "object",
              "required": [
                "id",
                "source",
                "target",
                "kind",
                "preferred_direction",
                "direct_connection_required",
                "source_anchor",
                "route_channel",
                "source_feature_ids"
              ],
              "properties": {
                "id": {
                  "type": "string",
                  "pattern": "^[A-Za-z0-9_.:-]+$"
                },
                "source": {
                  "type": "string",
                  "minLength": 1
                },
                "target": {
                  "type": "string",
                  "minLength": 1
                },
                "label": {
                  "type": "string"
                },
                "kind": {
                  "enum": [
                    "control",
                    "data",
                    "authorization",
                    "state",
                    "association"
                  ]
                },
                "preferred_direction": {
                  "enum": [
                    "vertical",
                    "horizontal",
                    "auto"
                  ]
                },
                "direct_connection_required": {
                  "const": true
                },
                "source_anchor": {
                  "type": "string"
                },
                "route_channel": {
                  "type": "string",
                  "pattern": "^[A-Za-z0-9_.:-]+$",
                  "description": "本关系独占的逻辑线路通道标识。"
                },
                "source_feature_ids": {
                  "type": "array",
                  "minItems": 1,
                  "items": {
                    "type": "string",
                    "pattern": "^F[0-9]{3}$"
                  },
                  "uniqueItems": true
                }
              },
              "additionalProperties": true
            }
          },
          "outputs": {
            "type": "object",
            "required": [
              "drawio",
              "preview_png",
              "final_png",
              "export_report"
            ],
            "properties": {
              "drawio": {
                "type": "string",
                "minLength": 1
              },
              "preview_png": {
                "type": "string",
                "minLength": 1
              },
              "final_png": {
                "type": "string",
                "minLength": 1
              },
              "svg": {
                "type": "string"
              },
              "export_report": {
                "type": "string",
                "minLength": 1
              },
              "drawio_lint_report": {
                "type": "string"
              }
            },
            "additionalProperties": false
          },
          "style_profile": {
            "enum": [
              "patent_monochrome",
              "patent_restrained_color"
            ]
          },
          "primary_question": {
            "type": "string",
            "minLength": 1,
            "description": "本图唯一需要回答的技术问题；不得并列多个主任务。"
          },
          "reading_direction": {
            "enum": [
              "left_to_right",
              "top_to_bottom"
            ]
          },
          "layers": {
            "type": "array",
            "minItems": 1,
            "items": {
              "type": "object",
              "required": [
                "id",
                "title",
                "order"
              ],
              "properties": {
                "id": {
                  "type": "string",
                  "pattern": "^[A-Za-z0-9_.:-]+$"
                },
                "title": {
                  "type": "string",
                  "minLength": 1
                },
                "order": {
                  "type": "integer",
                  "minimum": 1
                }
              },
              "additionalProperties": false
            }
          },
          "complexity_budget": {
            "type": "object",
            "required": [
              "max_technical_elements",
              "max_relations",
              "max_decisions"
            ],
            "properties": {
              "max_technical_elements": {
                "type": "integer",
                "minimum": 1,
                "maximum": 30
              },
              "max_relations": {
                "type": "integer",
                "minimum": 1,
                "maximum": 50
              },
              "max_decisions": {
                "type": "integer",
                "minimum": 0,
                "maximum": 10
              }
            },
            "additionalProperties": false
          },
          "normal_exit_ids": {
            "type": "array",
            "minItems": 1,
            "items": {
              "type": "string",
              "pattern": "^[A-Za-z0-9_.:-]+$"
            },
            "uniqueItems": true
          },
          "exception_exit_ids": {
            "type": "array",
            "items": {
              "type": "string",
              "pattern": "^[A-Za-z0-9_.:-]+$"
            },
            "uniqueItems": true
          },
          "spec_assertions": {
            "type": "array",
            "minItems": 1,
            "items": {
              "type": "object",
              "required": [
                "anchor",
                "element_ids",
                "relation_ids"
              ],
              "properties": {
                "anchor": {
                  "type": "string",
                  "minLength": 1
                },
                "element_ids": {
                  "type": "array",
                  "items": {
                    "type": "string",
                    "pattern": "^[A-Za-z0-9_.:-]+$"
                  },
                  "uniqueItems": true
                },
                "relation_ids": {
                  "type": "array",
                  "items": {
                    "type": "string",
                    "pattern": "^[A-Za-z0-9_.:-]+$"
                  },
                  "uniqueItems": true
                }
              },
              "additionalProperties": false
            }
          }
        },
        "additionalProperties": true
      }
    },
    "production_skill": {
      "const": "drawio-skill"
    }
  },
  "additionalProperties": true
}
